[
  {
    "id": "orangetown-ny-2025-10-01",
    "jurisdiction": "Orangetown",
    "state": "NY",
    "county": "Rockland County",
    "lat": 41.0468,
    "lng": -73.9496,
    "action_type": "protest",
    "date": "2025-10-01",
    "status": "ongoing",
    "company": "DataBank",
    "project_name": "Orangeburg Data Center Expansion",
    "building_sq_ft": 146000,
    "concerns": ["water", "noise", "environment", "property_values", "wildlife", "grid_reliability", "process_fairness", "community_character"],
    "opposition_groups": ["Bi-State Datacenter Crisis Coalition"],
    "opposition_website": "https://datacentercrisis.org/",
    "summary": "Over 100 residents from New York and New Jersey objected to DataBank's proposal for a 146,000 sq-ft data center adjacent to Lake Tappan reservoir. The Bi-State Datacenter Crisis Coalition organized opposition citing threats to wetlands, wildlife, water quality, and fire risks from lithium-ion battery storage.",
    "sources": [
      "https://rcbizjournal.com/2025/11/05/orangetown-weighs-second-data-center-on-banks-of-lake-tappan-reservoir/",
      "https://datacentercrisis.org/",
      "https://datacentercrisis.org/f/fight-massive-datacenter-expansion-by-lake-tappan-reservoir"
    ],
    "data_source": "news",
    "last_updated": "2026-03-02"
  },
  {
    "id": "lansing-ny-2025-09-24",
    "jurisdiction": "Lansing",
    "state": "NY",
    "county": "Tompkins County",
    "lat": 42.5715,
    "lng": -76.5278,
    "action_type": "moratorium",
    "date": "2025-09-24",
    "status": "ongoing",
    "company": "TeraWulf",
    "megawatts": 400,
    "acreage": 183,
    "concerns": ["electricity_rates", "noise", "water", "environment", "community_character"],
    "opposition_groups": ["Sustainable Finger Lakes"],
    "summary": "TeraWulf signed an 80-year lease for 183 acres at a former coal plant on Cayuga Lake to develop up to 400 MW of data center capacity. Hundreds of residents submitted public comments opposing the project, and the town held a public hearing on a moratorium to pause large-scale development while rewriting the zoning code.",
    "sources": [
      "https://insideclimatenews.org/news/08112025/lansing-new-york-data-center-development/",
      "https://ithacavoice.org/2025/12/the-controversial-zoning-question-lansings-data-center-is-betting-on/",
      "https://www.cornellsun.com/article/2025/11/tensions-over-terawulf-data-center-in-tompkins-county-grow-with-threatened-lawsuit"
    ],
    "data_source": "news",
    "last_updated": "2026-03-02"
  },
  {
    "id": "new-york-statewide-ny-2026-02-06",
    "jurisdiction": "New York (statewide moratorium bill)",
    "state": "NY",
    "lat": 42.6526,
    "lng": -73.7562,
    "action_type": "legislative_action",
    "date": "2026-02-06",
    "status": "pending",
    "concerns": ["electricity_rates", "water", "air_quality", "environment", "grid_reliability"],
    "opposition_groups": ["Food & Water Watch"],
    "summary": "State Sen. Liz Krueger and Assemblymember Anna Kelles introduced S.9144, a three-year moratorium on new data center permitting while DEC completes an environmental impact statement. Over 100 New York organizations endorsed the bill, called the 'strongest data center moratorium in the country.'",
    "sources": [
      "https://www.commondreams.org/news/ny-data-center-moratorium",
      "https://techcrunch.com/2026/02/07/new-york-lawmakers-propose-a-three-year-pause-on-new-data-centers/",
      "https://www.foodandwaterwatch.org/2026/03/02/100-new-york-groups-call-for-passage-of-data-center-moratorium-bill/"
    ],
    "data_source": "news",
    "last_updated": "2026-03-02"
  },
  {
    "id": "maryland-statewide-md-2026-01-01",
    "jurisdiction": "Maryland (statewide HB 120)",
    "state": "MD",
    "lat": 38.9784,
    "lng": -76.4922,
    "action_type": "legislative_action",
    "date": "2026-01-01",
    "status": "pending",
    "concerns": ["electricity_rates", "environment", "grid_reliability", "water"],
    "summary": "Maryland HB 120 would prohibit construction of new data centers and prohibit state or local approvals unless the General Assembly enacts legislation related to co-location with power generation. The General Assembly also overrode Gov. Moore's veto to mandate an environmental and economic impact study due September 2026.",
    "sources": [
      "https://marylandmatters.org/2026/01/03/data-center-regulations-2026/",
      "https://goodjobsfirst.org/data-center-moratorium-bills-are-spreading-in-2026/",
      "https://technical.ly/civics/maryland-data-center-impact-study-veto-override/"
    ],
    "data_source": "news",
    "last_updated": "2026-03-02"
  },
  {
    "id": "montgomery-county-md-2026-02-02",
    "jurisdiction": "Montgomery County",
    "state": "MD",
    "county": "Montgomery County",
    "lat": 39.1547,
    "lng": -77.2405,
    "action_type": "moratorium",
    "date": "2026-02-02",
    "status": "active",
    "concerns": ["electricity_rates", "water", "environment", "community_character", "air_quality"],
    "opposition_groups": ["Sugarloaf Citizens Association", "Food & Water Watch", "Elders Climate Action Maryland"],
    "summary": "Montgomery County Council voted unanimously to pause data center permitting through end of 2026, requiring a study on how to regulate placement and construction. A proposed data center complex in Dickerson at the former coal plant site near the Potomac River drew fierce opposition at a packed town hall.",
    "sources": [
      "https://www.foodandwaterwatch.org/2026/02/24/md-advocates-residents-call-for-data-center-moratorium-at-town-hall/",
      "https://www.thebanner.com/economy/growth-development/montgomery-county-data-centers-elrich-moratorium-regulations-GIJORCK4OJHZ7P3QCWFDB75HLE/",
      "https://sugarloafcitizens.org/issues-blog/data-center-complex-proposed-for-dickerson"
    ],
    "data_source": "news",
    "last_updated": "2026-03-02"
  },
  {
    "id": "baltimore-county-md-2026-02-02",
    "jurisdiction": "Baltimore County",
    "state": "MD",
    "county": "Baltimore County",
    "lat": 39.4010,
    "lng": -76.6065,
    "action_type": "moratorium",
    "date": "2026-02-02",
    "status": "active",
    "concerns": ["electricity_rates", "environment", "community_character"],
    "summary": "Baltimore County Council unanimously passed a bill to temporarily freeze data center development, blocking permits until the Planning Board studies potential environmental and economic impacts. The moratorium may last through end of 2026.",
    "sources": [
      "https://www.thebanner.com/economy/growth-development/baltimore-county-data-center-moratorium-EVIJFJDL5VGCDNC22K52NQBMGI/",
      "https://www.bayjournal.com/news/energy/maryland-counties-to-data-center-industry-slow-down/article_c8362372-9a29-4ef9-925a-c81840390a95.html"
    ],
    "data_source": "news",
    "last_updated": "2026-03-02"
  },
  {
    "id": "carroll-county-md-2026-02-01",
    "jurisdiction": "Carroll County",
    "state": "MD",
    "county": "Carroll County",
    "lat": 39.5628,
    "lng": -77.0016,
    "action_type": "moratorium",
    "date": "2026-02-01",
    "status": "pending",
    "concerns": ["electricity_rates", "environment", "water"],
    "summary": "Carroll County is weighing a moratorium similar to those adopted by Frederick, Prince George's, Baltimore, and Montgomery counties, as data center opposition spreads across Maryland.",
    "sources": [
      "https://marylandmatters.org/2026/01/03/data-center-regulations-2026/",
      "https://www.bayjournal.com/news/energy/maryland-counties-to-data-center-industry-slow-down/article_c8362372-9a29-4ef9-925a-c81840390a95.html"
    ],
    "data_source": "news",
    "last_updated": "2026-03-02"
  },
  {
    "id": "prince-georges-county-md-2025-09-01",
    "jurisdiction": "Prince George's County",
    "state": "MD",
    "county": "Prince George's County",
    "lat": 38.8296,
    "lng": -76.8452,
    "action_type": "moratorium",
    "date": "2025-09-01",
    "status": "active",
    "company": "Lerner Enterprises",
    "project_name": "Brightseat Tech Park (Landover Mall site)",
    "investment_million_usd": 5000,
    "megawatts": 820,
    "acreage": 87,
    "petition_url": "https://www.change.org/p/stop-data-center-at-landover-mall",
    "petition_signatures": 22500,
    "concerns": ["electricity_rates", "noise", "air_quality", "property_values", "environment", "process_fairness", "community_character"],
    "summary": "County Executive Aisha Braveboy issued an executive order pausing the $5B Brightseat Tech Park at the former Landover Mall site and establishing a task force. A Change.org petition gathered over 22,500 signatures. Opponents cite environmental racism in the predominantly Black community and lack of public engagement.",
    "sources": [
      "https://afro.com/landover-data-center-opposition/",
      "https://wtop.com/maryland/2025/09/dozens-rally-against-data-center-project-at-abandoned-mall-site/",
      "https://www.washingtonpost.com/dc-md-va/2026/01/01/data-centers-prince-georges-county/",
      "https://afrotech.com/prince-georges-county-pauses-landover-mall-data-center-project"
    ],
    "data_source": "news",
    "last_updated": "2026-03-02"
  },
  {
    "id": "tucker-county-wv-2025-08-01",
    "jurisdiction": "Tucker County",
    "state": "WV",
    "county": "Tucker County",
    "lat": 39.1120,
    "lng": -79.5612,
    "action_type": "protest",
    "date": "2025-08-01",
    "status": "ongoing",
    "company": "Fundamental Data",
    "concerns": ["noise", "air_quality", "environment", "community_character", "process_fairness", "water"],
    "opposition_groups": ["West Virginia Highlands Conservancy", "WV Citizens Action Group"],